<!ELEMENT filter (include+, filter-sci)>
  <!ATTLIST filter name  CDATA #REQUIRED>

<!ELEMENT include EMPTY>
  <!ATTLIST include href CDATA #REQUIRED>

<!ELEMENT filter-sci (package, category, instantiations, includes)>
  <!ATTLIST filter-sci name CDATA #REQUIRED>

<!ELEMENT package (#PCDATA)>

<!ELEMENT category (#PCDATA)>

<!ELEMENT instantiations (instance*)>
  <!ATTLIST instantiations use-defaults (yes|no) "no">

<!ELEMENT instance (type+)>
  <!ATTLIST instance num CDATA #REQUIRED>

<!ELEMENT type (value)>
  <!ATTLIST type name CDATA #REQUIRED>

<!ELEMENT value (#PCDATA)>

<!ELEMENT includes (file*)>

<!ELEMENT file (#PCDATA)>