<?xml version="1.0" encoding="iso-8859-1"?>
<!DOCTYPE filter SYSTEM "sci_filter.dtd">
<filter name="ThresholdSegmentationLevelSetImageFilter">
  <include href="ITK/itk_ThresholdSegmentationLevelSetImageFilter.xml"/>
  <include href="Dataflow/Modules/Filters/XML/gui_ThresholdSegmentationLevelSetImageFilter_Darby.xml"/>

<filter-sci name="ThresholdSegmentationLevelSetImageFilter">
  <package>Insight</package>

  <category>Filters</category>

  <instantiations>
    <instance num="1">
      <type name="ImageType">
        <value>itk::Image&lt;float, 2&gt;</value>
      </type>
      <type name="FeatureImageType">
        <value>itk::Image&lt;float, 2&gt;</value>
      </type>
     </instance>
  </instantiations>

  <includes>
    <file>Packages/Insight/Dataflow/Ports/ITKDatatypePort.h</file>
  </includes>

</filter-sci>

</filter>