<?xml version="1.0"?>
<!DOCTYPE filter SYSTEM "sci_filter.dtd">
<filter name="GradientMagnitude">
  <include href="ITK/itk_GradientMagnitudeImageFilter.xml"/>
  <include href="Dataflow/Modules/Filters/XML/gui_GradientMagnitudeImageFilter_Darby.xml"/>

<filter-sci name="GradientMagnitude">
  <package>Insight</package>

  <category>Filters</category>

  <instantiations>
    <instance num="1">
      <type name="InputImageType">
        <value>itk::Image&lt;float, 2&gt;</value>
      </type>
      <type name="OutputImageType">
        <value>itk::Image&lt;float, 2&gt;</value>
      </type>
     </instance>
    <instance num="2">
      <type name="InputImageType">
        <value>itk::Image&lt;float, 3&gt;</value>
      </type>
      <type name="OutputImageType">
        <value>itk::Image&lt;float, 3&gt;</value>
      </type>
     </instance>
  </instantiations>

  <includes>
    <file>Packages/Insight/Dataflow/Ports/ITKDatatypePort.h</file>
  </includes>

</filter-sci>

</filter>